{
  "schema_version": "1.0.0",
  "artifact_id": "074605ec-ec53-4e57-8eaf-ac423b620bf8",
  "created_at": "2026-06-12T15:02:08Z",
  "source_tool": {
    "name": "custbench-async",
    "version": "0.1.0",
    "enrichment_version": "1.0.0"
  },
  "model": {
    "name": "Nemotron-3-Super-120B-A12B",
    "id": "nvidia/NVIDIA-Nemotron-3-Super-120B-A12B-FP8",
    "architecture": "hybrid-mamba-moe",
    "parameters_total": "120B",
    "parameters_active": "12B",
    "quantization": "fp8",
    "max_model_len": 16384
  },
  "engine": {
    "name": "sglang",
    "container_image": "vllm/vllm-openai:v0.22.1",
    "base_image": null,
    "dockerfile": null,
    "tensor_parallel": 2,
    "pipeline_parallel": 1,
    "data_parallel": null,
    "expert_parallel": null,
    "replicas": 4,
    "reasoning": false,
    "kv_cache_dtype": "fp8",
    "attention_backend": "auto",
    "speculative_decode": null,
    "engine_config_tag": "h200-sglang-tp2x4-fp8-v0512",
    "extra_args": {
      "fp8-gemm-backend": "triton",
      "moe-runner-backend": "flashinfer_cutlass",
      "mamba-scheduler-strategy": "no_buffer",
      "reasoning-parser": "nemotron_3"
    }
  },
  "infrastructure": {
    "substrate": "eks",
    "instance_type": "p5e.48xlarge",
    "region": "us-east-2",
    "gpu": {
      "name": "H200",
      "arch": "sm_90",
      "count": 8,
      "vram_gb": 141,
      "interconnect": "nvswitch-nvl5"
    }
  },
  "workload": {
    "use_case": "fin-support",
    "catalog_id": "fin-support",
    "modality": "text",
    "dataset": {
      "type": "rag-augmented",
      "input_tokens": {
        "mean": 9080.8,
        "p50": 8857,
        "p90": 12017
      },
      "output_tokens": {
        "mean": 76,
        "p90": 105
      }
    },
    "load": {
      "type": "concurrency",
      "concurrency": 96,
      "num_prompts": 2000,
      "warmup_requests": 0
    },
    "api": {
      "type": "chat",
      "streaming": true,
      "endpoint": "/v1/chat/completions"
    }
  },
  "metrics": {
    "duration_s": 261.31,
    "completed": 2000,
    "failed": 0,
    "error_rate": 0.0,
    "ttft_ms": {
      "mean": 473.2,
      "p50": 473.2,
      "p90": 924.6,
      "p95": 3218.5,
      "p99": 5512.4
    },
    "tpot_ms": {
      "mean": 149.9,
      "p50": 149.9,
      "p90": null,
      "p95": null,
      "p99": 199.9
    },
    "itl_ms": {
      "mean": 149.9,
      "p50": 149.9,
      "p90": null,
      "p95": null,
      "p99": 199.9
    },
    "e2e_ms": {
      "mean": 12426.4,
      "p50": 11947.5,
      "p90": 17107.4,
      "p95": 19509.85,
      "p99": 21912.3
    },
    "output_toks_per_s": 581.7,
    "request_throughput": 7.654,
    "total_toks_per_s": 70083.8,
    "total_input_tokens": 18161600,
    "total_output_tokens": 152000,
    "max_concurrent_requests": 96
  },
  "slo": {
    "targets": {
      "e2e_p50_ms": 6500,
      "e2e_p90_ms": 9500,
      "ttft_p99_ms": 6000,
      "tpot_p99_ms": 50,
      "error_rate_max": 0.001
    },
    "results": {
      "e2e_p50_ms": {
        "target": 6500,
        "actual": 11947.5,
        "pass": false
      },
      "e2e_p90_ms": {
        "target": 9500,
        "actual": 17107.4,
        "pass": false
      },
      "ttft_p99_ms": {
        "target": 6000,
        "actual": 5512.4,
        "pass": true
      },
      "tpot_p99_ms": {
        "target": 50,
        "actual": 199.9,
        "pass": false
      },
      "error_rate_max": {
        "target": 0.001,
        "actual": 0.0,
        "pass": true
      }
    },
    "overall_pass": false
  },
  "extensions": {
    "cost": {
      "instance_cost_per_hr": 30.1,
      "cost_basis": "spot",
      "dollars_per_1m_total_tokens": 0.1193,
      "dollars_per_1m_output_tokens": 14.3736,
      "formula": "(30.1 / 70083.8 tot_tok/s) * (1e6 / 3600)"
    },
    "prefix_cache": {
      "hit_rate_measured": null,
      "corpus_ceiling": 0.3,
      "pre": null,
      "post": null
    },
    "augmentation_audit": {
      "real_vs_synthetic_split": {
        "synthetic": 0,
        "real": 2000
      },
      "distinct_prompt_fraction": 1.0
    },
    "reliability_flags": {
      "prefix_hit_rate_gt_corpus_ceiling": false
    },
    "session_metadata": {
      "platform": "h200",
      "engine_config_tag": "h200-sglang-tp2x4-fp8-v0512",
      "source_filename": "fin-support_h200-sglang-tp2x4-fp8-v0512_c96_20260612-150208.json",
      "blueprint": "domains/gpu-serving/blueprints/fin-rag-answer-h200",
      "run_date": "20260612",
      "enrichment_note": "Generated from custbench fin-support flat format. Cost is $/1M TOTAL tokens (prefill+decode) \u2014 this is a prefill-dominated RAG workload; output-only $/1M also emitted. TPOT has p50/p99 only (no p90 captured by driver)."
    }
  }
}