{
  "schema_version": "1.0.0",
  "artifact_id": "34076495-25db-4bdc-9b93-0f80e981d349",
  "created_at": "2026-05-14T17:15:56Z",
  "source_tool": {
    "name": "custom",
    "version": "0.1.0-qwen3-reranker",
    "enrichment_version": "1.0.0"
  },
  "model": {
    "name": "Qwen3-Reranker-4B",
    "id": "Qwen/Qwen3-Reranker-4B",
    "architecture": "cross-encoder",
    "parameters_total": "4B",
    "quantization": "bf16",
    "max_model_len": 4096
  },
  "engine": {
    "name": "vllm",
    "version": "0.19.1",
    "container_image": "vllm/vllm-openai:v0.19.1",
    "base_image": null,
    "dockerfile": null,
    "tensor_parallel": 1,
    "pipeline_parallel": 1,
    "data_parallel": null,
    "expert_parallel": null,
    "replicas": 1,
    "reasoning": false,
    "kv_cache_dtype": "auto",
    "attention_backend": "flash-attn",
    "speculative_decode": null,
    "extra_args": {
      "runner": "pooling",
      "convert": "classify",
      "trust-remote-code": true,
      "max-num-seqs": 64,
      "gpu-memory-utilization": 0.9,
      "hf_overrides": {
        "architectures": [
          "Qwen3ForSequenceClassification"
        ],
        "classifier_from_token": [
          "no",
          "yes"
        ],
        "is_original_qwen3_reranker": true
      }
    }
  },
  "infrastructure": {
    "substrate": "eks",
    "instance_type": "g6e.2xlarge",
    "region": "us-east-2",
    "gpu": {
      "name": "L40S",
      "arch": "sm_89",
      "count": 1,
      "vram_gb": 48,
      "interconnect": "none"
    },
    "substrate_deviation": {
      "spec_preferred_instance": "g6.xlarge",
      "spec_preferred_gpu": "L4 24GB",
      "reason": "Session reuse \u2014 g6e.2xlarge already provisioned for deepseek-ocr. Cost-efficiency row is NOT valid for L4; per-stream latency is an upper bound (L40S has ~33% more TFLOPS and 2x VRAM headroom)."
    }
  },
  "workload": {
    "use_case": "reranker",
    "catalog_id": "rag-long-context",
    "modality": "text",
    "dataset": {
      "type": "synthetic-lorem-corpus",
      "source": "scripts/_common.py::build_corpus",
      "input_tokens": {
        "mean": 41116.0
      },
      "output_tokens": {
        "mean": 0
      },
      "pair_length": 1024
    },
    "load": {
      "type": "concurrency",
      "pair_length_axis": [
        512,
        1024,
        2048,
        4096
      ],
      "max_concurrency": 4,
      "num_prompts_per_length": 50,
      "warmup_requests": 10,
      "current_pair_length": 512
    },
    "api": {
      "type": "score",
      "streaming": false,
      "endpoint": "/v1/score",
      "prompt_template": "query + k=50 candidates"
    }
  },
  "metrics": {
    "duration_s": 6.361139332992025,
    "completed": 50,
    "failed": 0,
    "error_rate": 0.0,
    "e2e_ms": {
      "mean": 494.70200166048016,
      "p50": 494.50416598119773,
      "p90": 512.4287499929778,
      "p95": 519.9545829964336,
      "p99": 673.4900000155903
    },
    "output_toks_per_s": 0.0,
    "request_throughput": 7.860227135833229,
    "total_input_tokens": 4233250,
    "total_output_tokens": 0,
    "max_concurrent_requests": 4,
    "ttft_ms": {
      "mean": null,
      "p50": null,
      "p90": null,
      "p95": null,
      "p99": null
    },
    "tpot_ms": {
      "mean": null,
      "p50": null,
      "p90": null,
      "p95": null,
      "p99": null
    },
    "itl_ms": {
      "mean": null,
      "p50": null,
      "p90": null,
      "p95": null,
      "p99": null
    }
  },
  "extensions": {
    "reranker": {
      "k_candidates": 50,
      "pair_length_target": 512,
      "pairs_per_s": 699.7186875624159,
      "total_pairs_scored": 2500
    },
    "substrate_caveat": "Measured on g6e.2xlarge (L40S 48GB) \u2014 spec-preferred is g6.xlarge (L4 24GB). Per-stream latency is an upper bound for L40S; cost claims should NOT be projected to the L4 row from this artifact.",
    "notes": "Iteration 2 pair-length axis sweep for Qwen3-Reranker-4B on vLLM 0.19.1. Concurrency fixed at c=4 (iter-1 saturation point). Pair-length axis [512, 1024, 2048, 4096]; k=50 candidates/request. Headline metrics from pair_length with best pairs/s; per-length breakdown in extensions.reranker.pair_length_sweep.",
    "catalog_id_remapped_from": "pair-length-sweep",
    "normalized_from": "blueprints/qwen3-reranker-4b-eks/results/artifacts/qwen3-reranker-4b_eks_g6e-2xl_vllm_pair-length-sweep_20260514T171508Z.json"
  }
}